{
  "schemaVersion": "lakda/target-manifest/v1",
  "manifestId": "sample-pending-target",
  "targetClass": "crm-list",
  "status": "pending_external",
  "owner": "unassigned",
  "environment": {
    "name": "staging",
    "baseUrlOrigin": null
  },
  "access": {
    "approved": false,
    "authSource": "pending_external",
    "approvalEvidenceRef": "pending_external"
  },
  "scope": {
    "allowHosts": [],
    "pathPrefixes": []
  },
  "safety": {
    "allowMutationKinds": ["none"],
    "resetProcedureRef": "pending_external",
    "killSwitchRef": "pending_external"
  },
  "privacy": {
    "piiPolicyRef": "pending_external",
    "sensitiveValuesPersisted": false
  },
  "actionContracts": [],
  "settleProfile": {
    "policyVersion": "lightweight-dom/v1",
    "networkQuietExclusions": []
  },
  "acceptance": {
    "p0ActionIds": [],
    "p1ActionIds": []
  }
}
